[
  {
    "id": "dwae-sentence-end",
    "pattern": "되$",
    "suggestion": "돼",
    "message": "문장을 끝맺을 땐 '돼'. ('돼=되+어', '해'가 자연스러우면 '돼')",
    "level": "Suspect"
  },
  {
    "id": "an-dwae",
    "pattern": "^되$",
    "suggestion": "안 돼",
    "message": "'안 되'가 아니라 '안 돼'. ('안 해'가 자연스러우면 '안 돼')",
    "level": "Suspect",
    "previousWordPattern": "^안$"
  },
  {
    "id": "anh-misuse",
    "pattern": "^않",
    "suggestion": "안",
    "message": "'않'은 '-지 않다' 형태로만. 앞에 '-지'가 없으면 부사 '안'일 수 있습니다.",
    "level": "Suspect",
    "previousWordNotPattern": "지$"
  },
  {
    "id": "ji-an",
    "pattern": "^안$",
    "suggestion": "않",
    "message": "'-지 안'이 아니라 '-지 않'. (예: 하지 않다)",
    "level": "Suspect",
    "previousWordPattern": "지$"
  }
]
